{
    "schema_version":  "1.0.0",
    "transition_id":  "guardian:claim-transition:m16-session-sequence-rejection:adjudicated:v1",
    "claim_id":  "guardian:claim:m16-session-sequence-rejection",
    "claim_version":  "1.0.0",
    "from_assessment_state":  "NOT_ASSESSED",
    "to_assessment_state":  "DEMONSTRATED",
    "from_adjudication_state":  "UNADJUDICATED",
    "to_adjudication_state":  "ACCEPTED",
    "assessment_record_id":  "guardian:assessment-record:m16-session-sequence-rejection:v1",
    "rule_id":  "guardian:assessment-rule:m16-session-sequence-rejection",
    "rule_version":  "1.0.0",
    "evidence_refs":  [
                          "guardian:evidence:m16-rr04a-session-sequence-host"
                      ],
    "contradictory_evidence_refs":  [

                                    ],
    "source_commit":  "50c34dd540ed9f9c658e6cb8c6d26e58594d4846",
    "source_tree":  "e5fe67e817b78b95b96d2c8f011de30b96173e92",
    "created_at":  "2026-09-07T14:57:04.889Z",
    "transition_reason":  "Human adjudication accepted the bounded M16-RR-04 technical assessment for session-local NodeLink duplicate and regressing sequence rejection. No persistent anti-replay, reboot persistence, physical hardware, MCXN947, production readiness, authority grant, or actuation claim is implied.",
    "adjudicator":  {
                        "identity":  "Antonio Socorro / socorromipunto-eng",
                        "adjudicated_at":  "2026-09-07T14:57:04.889Z"
                    }
}
